{
  "postId": "post_016",
  "language": "ku",
  "platform": "twitter",
  "content": "🗳️ دەنگت گرنگە! بەشداری لە دروستکردنی داهاتووی عێراق بکە لە ڕێگەی تۆماری دەنگدان. سەردانی ماڵپەڕەکەمان بکە.",
  "hashtags": [
    "#عێراق",
    "#هەڵبژاردن",
    "#دەنگت_گرنگە",
    "#بەشداری_مەدەنی"
  ],
  "governorate": "Basra",
  "targetAudience": "18-35",
  "scheduledFor": "2025-10-30T05:29:22.266Z",
  "visualDescription": "Kurdish citizens voting with Kurdistan and Iraq flags",
  "tone": "engaging",
  "contentType": "call-to-action",
  "neutralityScore": 1,
  "timestamp": "2025-10-28T21:29:22.252Z",
  "agentSignature": "Agent4_ContentCreation"
}