{
  "postId": "post_014",
  "language": "ar",
  "platform": "facebook",
  "content": "💡 هل تعلم؟ منصتنا تتيح لك مقارنة برامج المرشحين واختيار الأنسب لمحافظتك.",
  "hashtags": [
    "#منصة_الانتخابات",
    "#العراق_الرقمي",
    "#التكنولوجيا"
  ],
  "governorate": "Baghdad",
  "targetAudience": "18-35",
  "scheduledFor": "2025-10-30T07:29:22.265Z",
  "visualDescription": "Modern app interface showing candidate comparison features",
  "tone": "engaging",
  "contentType": "civic-engagement",
  "neutralityScore": 1,
  "timestamp": "2025-10-28T21:29:22.252Z",
  "agentSignature": "Agent4_ContentCreation"
}