{
  "postId": "post_012",
  "language": "ar",
  "platform": "facebook",
  "content": "👤 تعرف على مرشحيك! منصتنا توفر معلومات شاملة عن جميع المرشحين في محافظتك. اتخذ قرارك المستنير.",
  "hashtags": [
    "#شفافية_الانتخابات",
    "#اعرف_مرشحك",
    "#العراق"
  ],
  "governorate": "Erbil",
  "targetAudience": "18-35",
  "scheduledFor": "2025-10-30T15:29:22.263Z",
  "visualDescription": "Professional candidate profile cards showing diverse Iraqi candidates",
  "tone": "engaging",
  "contentType": "educational",
  "neutralityScore": 1,
  "timestamp": "2025-10-28T21:29:22.252Z",
  "agentSignature": "Agent4_ContentCreation"
}