{
  "postId": "post_010",
  "language": "ar",
  "platform": "twitter",
  "content": "📚 دليل الناخب: تعرف على حقوقك وواجباتك كمواطن عراقي. التصويت حق وواجب وطني.",
  "hashtags": [
    "#التوعية_المدنية",
    "#حقوق_الناخبين",
    "#العراق"
  ],
  "governorate": "Baghdad",
  "targetAudience": "18-35",
  "scheduledFor": "2025-10-30T11:29:22.262Z",
  "visualDescription": "Infographic showing voter rights and responsibilities",
  "tone": "engaging",
  "contentType": "educational",
  "neutralityScore": 1,
  "timestamp": "2025-10-28T21:29:22.252Z",
  "agentSignature": "Agent4_ContentCreation"
}