{
  "postId": "post_028",
  "language": "ku",
  "platform": "twitter",
  "content": "📅 بۆنەیەکی داهاتوو! پێوەمان ببە لە گفتوگۆیەکی کۆمەڵایەتی دەربارەی داهاتووی عێراق.",
  "hashtags": [
    "#بۆنەکانی_هەڵبژاردن",
    "#گفتوگۆی_کۆمەڵگا",
    "#عێراق"
  ],
  "governorate": "Baghdad",
  "targetAudience": "18-35",
  "scheduledFor": "2025-10-30T05:29:22.276Z",
  "visualDescription": "Community dialogue event in Kurdistan region",
  "tone": "engaging",
  "contentType": "event-promotion",
  "neutralityScore": 1,
  "timestamp": "2025-10-28T21:29:22.252Z",
  "agentSignature": "Agent4_ContentCreation"
}