{
  "postId": "post_029",
  "language": "ku",
  "platform": "twitter",
  "content": "💡 ئایا دەزانی؟ پلاتفۆرمەکەمان ڕێگەت پێدەدات بەراوردی بەرنامەکانی کاندیدەکان بکەیت.",
  "hashtags": [
    "#پلاتفۆرمی_هەڵبژاردن",
    "#عێراقی_دیجیتاڵ",
    "#تەکنەلۆژیا"
  ],
  "governorate": "National",
  "targetAudience": "18-35",
  "scheduledFor": "2025-10-30T07:29:22.276Z",
  "visualDescription": "Digital platform showing candidate comparison in Kurdish",
  "tone": "engaging",
  "contentType": "civic-engagement",
  "neutralityScore": 1,
  "timestamp": "2025-10-28T21:29:22.252Z",
  "agentSignature": "Agent4_ContentCreation"
}