{
  "postId": "post_017",
  "language": "ku",
  "platform": "instagram",
  "content": "👤 کاندیدەکانت بناسە! پلاتفۆرمەکەمان زانیاری تەواو دەربارەی کاندیدەکان پێشکەش دەکات.",
  "hashtags": [
    "#شەفافیەتی_هەڵبژاردن",
    "#کاندیدەکانت_بناسە",
    "#عێراق"
  ],
  "governorate": "National",
  "targetAudience": "18-35",
  "scheduledFor": "2025-10-30T07:29:22.266Z",
  "visualDescription": "Candidate profiles in Kurdish language interface",
  "tone": "engaging",
  "contentType": "educational",
  "neutralityScore": 1,
  "timestamp": "2025-10-28T21:29:22.252Z",
  "agentSignature": "Agent4_ContentCreation"
}