{
  "postId": "post_006",
  "language": "ar",
  "platform": "twitter",
  "content": "๐ณ๏ธ ุตูุชู ููู! ุดุงุฑู ูู ุจูุงุก ูุณุชูุจู ุงูุนุฑุงู ูู ุฎูุงู ุงูุชุณุฌูู ููุงูุชุฎุงุจุงุช. ุฒุฑ ูููุนูุง ููุชุนุฑู ุนูู ุงููุฑุดุญูู ูุงููุนุงููุงุช ูู ูุญุงูุธุชู.",
  "hashtags": [
    "#ุงูุนุฑุงู",
    "#ุงูุงูุชุฎุงุจุงุช",
    "#ุตูุชู_ููู",
    "#ุงููุดุงุฑูุฉ_ุงููุฏููุฉ"
  ],
  "governorate": "Basra",
  "targetAudience": "18-35",
  "scheduledFor": "2025-10-30T15:29:22.259Z",
  "visualDescription": "Illustration of an Iraqi citizen casting a ballot with Iraqi flag colors in background",
  "tone": "engaging",
  "contentType": "call-to-action",
  "neutralityScore": 1,
  "timestamp": "2025-10-28T21:29:22.252Z",
  "agentSignature": "Agent4_ContentCreation"
}