{
  "postId": "post_030",
  "language": "ku",
  "platform": "facebook",
  "content": "📚 ڕێنمایی دەنگدەر: مافەکانت و ئەرکەکانت وەک هاوڵاتی عێراقی بزانە.",
  "hashtags": [
    "#خوێندنەوەی_مەدەنی",
    "#مافی_دەنگدەران",
    "#عێراق"
  ],
  "governorate": "National",
  "targetAudience": "18-35",
  "scheduledFor": "2025-10-30T09:29:22.277Z",
  "visualDescription": "Voter guide infographic in Kurdish language",
  "tone": "engaging",
  "contentType": "educational",
  "neutralityScore": 1,
  "timestamp": "2025-10-28T21:29:22.252Z",
  "agentSignature": "Agent4_ContentCreation"
}